{
  "id": "wq-005",
  "family_id": "paraphrase",
  "query": "How can I get the system running again from where it stopped after something failed?",
  "relevant_refs": ["langgraph__resume-runs"],
  "partially_relevant_refs": ["langgraph__checkpointing"],
  "relevant_sections": ["langgraph__resume-runs"],
  "reviewer": "sh-ai-x",
  "split": "dev"
}
